{"$schema":"https://json-schema.org/draft/2020-12/schema","$id":"https://sister.dev/contracts/reflexivity/1.0.0/operational-assessment.schema.json","type":"object","required":["assessment_id","execution_id","profile_id","reference_snapshot_id","evaluator","evidence","result","severity","gate_effect","proposed_action","operational_effect"],"additionalProperties":false,"properties":{"assessment_id":{"type":"string"},"execution_id":{"type":"string"},"profile_id":{"type":"string"},"reference_snapshot_id":{"type":"string"},"evaluator":{"type":"object","required":["id","version"],"properties":{"id":{"type":"string"},"version":{"type":"string"}},"additionalProperties":false},"evidence":{"type":"array","items":{"$ref":"evidence-reference.schema.json"}},"result":{"enum":["confirmed","divergent","inconclusive","not_applicable"]},"severity":{"enum":["informational","low","medium","high","critical"]},"gate_effect":{"enum":["shadow","pass","warn","block"]},"proposed_action":{"enum":["none","collect_evidence","recommend","request_approval"]},"operational_effect":{"const":"none"},"explanation":{"type":"string"},"limitations":{"type":"array","items":{"type":"string"}},"assessed_at":{"type":"string","format":"date-time"}}}
