{"assessment_id":"ASM-NC-EXAMPLE-001","execution_id":"RUN-NC-EXAMPLE-001","profile_id":"RFP-NC-01","reference_snapshot_id":"REFSNAP-NC-EXAMPLE-001","evaluator":{"id":"ASM-REF-01","version":"1.0.0"},"evidence":[],"result":"inconclusive","severity":"informational","gate_effect":"shadow","proposed_action":"none","operational_effect":"none","explanation":"Evidência insuficiente para concluir."}
