{"assessment_id":"ASM-NC-NA-001","execution_id":"RUN-NC-003","profile_id":"RFP-NC-01","reference_snapshot_id":"REFSNAP-NC-EXAMPLE-001","evaluator":{"id":"ASM-REF-01","version":"1.0.0"},"evidence":[{"evidence_id":"EV-NC-003","kind":"execution-context","digest":"sha256:example-evidence-3"}],"result":"not_applicable","severity":"informational","gate_effect":"shadow","proposed_action":"none","operational_effect":"none","explanation":"O critério não se aplica ao contexto declarado."}
