{"assessment_id":"ASM-NC-DIVERGENT-001","execution_id":"RUN-NC-002","profile_id":"RFP-NC-01","reference_snapshot_id":"REFSNAP-NC-EXAMPLE-001","evaluator":{"id":"ASM-REF-01","version":"1.0.0"},"evidence":[{"evidence_id":"EV-NC-002","kind":"integration-receipt","digest":"sha256:example-evidence-2"}],"result":"divergent","severity":"low","gate_effect":"shadow","proposed_action":"none","operational_effect":"none","explanation":"Foi observada divergência não bloqueante no piloto."}
