{"assessment_id":"ASM-NC-CONFIRMED-001","execution_id":"RUN-NC-001","profile_id":"RFP-NC-01","reference_snapshot_id":"REFSNAP-NC-EXAMPLE-001","evaluator":{"id":"ASM-REF-01","version":"1.0.0"},"evidence":[{"evidence_id":"EV-NC-001","kind":"integration-receipt","digest":"sha256:example-evidence"}],"result":"confirmed","severity":"informational","gate_effect":"shadow","proposed_action":"none","operational_effect":"none","explanation":"Execução compatível com as referências observadas."}
